{
  "schemaVersion": 1,
  "skillId": "skill-fragile-mug-001",
  "workflowType": "fragilePackingV1",
  "title": "Pack fragile ceramic mug",
  "videos": [
    {
      "videoId": "video-001",
      "sourceKey": "skills/skill-fragile-mug-001/source/videos/video-001.mp4",
      "mimeType": "video/mp4"
    },
    {
      "videoId": "video-002",
      "sourceKey": "skills/skill-fragile-mug-001/source/videos/video-002.mp4",
      "mimeType": "video/mp4"
    }
  ],
  "referenceImages": [
    {
      "imageId": "image-001",
      "sourceKey": "skills/skill-fragile-mug-001/source/images/image-001.jpg",
      "mimeType": "image/jpeg"
    }
  ],
  "documents": [
    {
      "documentId": "doc-packing-policy-001",
      "sourceKey": "skills/skill-fragile-mug-001/source/documents/doc-packing-policy-001.pdf",
      "mimeType": "application/pdf"
    }
  ],
  "sourceLanguage": "enIN",
  "outputLanguages": [
    "enIN",
    "hiIN"
  ],
  "expectedObjects": [
    "ceramic mug",
    "bubble wrap",
    "cardboard box",
    "tape",
    "fragile label"
  ],
  "supervisorNotes": "Ensure double layer bubble wrap before boxing"
}
